{
  "schemaVersion": "1.0",
  "receiptId": "13631945-5617-575b-a8bb-bb37b9404604",
  "manifestId": "4f6e516e-d171-55f7-9a4b-801fa6c8fe5d",
  "manifestSha256": "593a2f0d50dbace61fc39b67edc9278ca0c4f0bb1c58c595b1af9d006b2be9c9",
  "episodeId": "d54760b5-9c2a-5fff-b1f0-1513cd1e7cac",
  "output": {
    "kind": "media_edge"
  },
  "result": "delivered",
  "attempt": 1,
  "idempotencyKey": "media_edge:4f6e516e-d171-55f7-9a4b-801fa6c8fe5d",
  "occurredAt": "2026-10-05T09:00:25Z",
  "edge": {
    "url": "https://media.relay.test/a/55a54d35-c5c1-5649-b95c-cef50e73d05b/tide-pools-at-dawn.mp3",
    "status": 200,
    "contentLength": 28311552,
    "contentType": "audio/mpeg",
    "rangeStatus": 206,
    "checks": {
      "lengthMatches": true,
      "typeMatches": true,
      "rangeSupported": true
    }
  }
}
