{
  "schemaVersion": "1.0",
  "receiptId": "dbac2dd9-2627-5111-82fc-228650a4705c",
  "manifestId": "4f6e516e-d171-55f7-9a4b-801fa6c8fe5d",
  "manifestSha256": "593a2f0d50dbace61fc39b67edc9278ca0c4f0bb1c58c595b1af9d006b2be9c9",
  "episodeId": "d54760b5-9c2a-5fff-b1f0-1513cd1e7cac",
  "output": {
    "kind": "destination",
    "publicationTargetId": "98efa5bd-1e83-5a72-81ee-16dd0abca8a2",
    "destinationKey": "youtube"
  },
  "result": "submitted",
  "attempt": 1,
  "idempotencyKey": "98efa5bd-1e83-5a72-81ee-16dd0abca8a2:4f6e516e-d171-55f7-9a4b-801fa6c8fe5d",
  "occurredAt": "2026-10-05T09:05:00Z",
  "external": {
    "externalId": "vid-000123"
  }
}
